{
  "$schema": "http://json-schema.org/draft-07/schema#",
  "$id": "https://example.local/regulatory-guideline-archive/derived/artifacts/effective_record.schema.json",
  "title": "EffectiveRecord Artifact",
  "type": "object",
  "additionalProperties": false,
  "required": ["derived_model_version", "artifact_type", "regulator_profile", "records"],
  "properties": {
    "derived_model_version": { "$ref": "https://example.local/regulatory-guideline-archive/derived/core.schema.json#/definitions/derivedModelVersion" },
    "artifact_type": { "const": "EffectiveRecord" },
    "regulator_profile": { "$ref": "https://example.local/regulatory-guideline-archive/derived/core.schema.json#/definitions/regulatorProfile" },
    "records": { "type": "array", "minItems": 1, "items": { "$ref": "#/definitions/effectiveRecord" } }
  },
  "definitions": {
    "effectiveRecord": {
      "type": "object",
      "additionalProperties": false,
      "required": ["effective_record_id", "guidance_family_id", "document_edition_id", "jurisdiction", "as_of_date", "effective_status", "derivation_basis", "amendment_mapping_ids", "contributing_record_ids", "source_references", "effective_text_en", "normalized_ko", "review_status", "profile_details"],
      "properties": {
        "effective_record_id": { "$ref": "https://example.local/regulatory-guideline-archive/derived/core.schema.json#/definitions/id" },
        "guidance_family_id": { "$ref": "https://example.local/regulatory-guideline-archive/derived/core.schema.json#/definitions/id" },
        "document_edition_id": { "$ref": "https://example.local/regulatory-guideline-archive/derived/core.schema.json#/definitions/id" },
        "jurisdiction": { "$ref": "https://example.local/regulatory-guideline-archive/derived/core.schema.json#/definitions/jurisdiction" },
        "as_of_date": { "$ref": "https://example.local/regulatory-guideline-archive/derived/core.schema.json#/definitions/date" },
        "effective_status": { "$ref": "https://example.local/regulatory-guideline-archive/derived/core.schema.json#/definitions/nonEmptyString" },
        "derivation_basis": { "$ref": "https://example.local/regulatory-guideline-archive/derived/core.schema.json#/definitions/derivationBasis" },
        "amendment_mapping_ids": { "$ref": "https://example.local/regulatory-guideline-archive/derived/core.schema.json#/definitions/idArray" },
        "contributing_record_ids": { "$ref": "https://example.local/regulatory-guideline-archive/derived/core.schema.json#/definitions/idArray" },
        "source_references": { "type": "array", "minItems": 1, "items": { "$ref": "https://example.local/regulatory-guideline-archive/derived/core.schema.json#/definitions/sourceDocumentRef" } },
        "effective_text_en": { "$ref": "https://example.local/regulatory-guideline-archive/derived/core.schema.json#/definitions/nonEmptyString" },
        "normalized_ko": { "$ref": "https://example.local/regulatory-guideline-archive/derived/core.schema.json#/definitions/nullableString" },
        "review_status": { "$ref": "https://example.local/regulatory-guideline-archive/derived/core.schema.json#/definitions/aggregateReviewStatus" },
        "profile_details": { "$ref": "https://example.local/regulatory-guideline-archive/derived/core.schema.json#/definitions/profileDetails" }
      }
    }
  }
}
