{
  "derived_model_version": "0.1.0",
  "artifact_type": "EffectiveRecord",
  "regulator_profile": "ich",
  "records": [
    {
      "effective_record_id": "fixture.effective.001",
      "guidance_family_id": "fixture.family.ich_s6",
      "document_edition_id": "fixture.edition.s6.r1",
      "jurisdiction": "ICH",
      "as_of_date": "2026-07-06",
      "effective_status": "current",
      "derivation_basis": "supplementary_source",
      "amendment_mapping_ids": [],
      "contributing_record_ids": ["fixture.kr.addendum_only"],
      "source_references": [
        {
          "document_id": "ich_s6_r1",
          "section_id": null,
          "source_unit_id": null,
          "pdf_page_index_zero_based": null,
          "printed_page_label": null,
          "source_text": "fixture source text"
        }
      ],
      "effective_text_en": "Fixture effective text.",
      "normalized_ko": null,
      "review_status": "needs_review",
      "profile_details": {
        "ich_derivation_detail": "addendum_without_parent_counterpart",
        "ich_step": "Step 4",
        "ich_code": "S6"
      }
    }
  ]
}
